{
  "category": "general",
  "code": {
    "component": "Button",
    "framework": "react",
    "import": "import { Button } from \"antd\";",
    "propMap": {
      "ariaLabel": "aria-label",
      "danger": "danger",
      "disabled": "disabled",
      "intent": "type",
      "label": "children",
      "size": "size"
    }
  },
  "compositionRules": [],
  "confidence": 0.92,
  "displayName": "Button",
  "examples": {
    "bad": [
      "[intent=primary] 用于次要操作（如详情页的'了解更多'放在已有 primary 旁，导致每 group 超过 1 个 primary）",
      "[intent=danger] 但 label 写'保存草稿'（语义与危险操作矛盾）",
      "[iconOnly=true] 但 ariaLabel 缺失（屏幕阅读器无法朗读按钮用途）",
      "[label] 超过 28 字符，例如'请点击这里以确认并提交本次订单的所有变更信息'（应精简为'提交订单变更'）",
      "[intent=danger, danger=false] 同时出现（intent 与 danger 布尔冲突，破坏归约一致性）",
      "[disabled=true] 同时用 loading 占位（两者语义重叠，应只保留 loading）"
    ],
    "good": [
      "[intent=primary, label='保存'] 主操作提交，每组仅 1 个",
      "[intent=default, label='取消'] 次要操作",
      "[intent=danger, label='删除文件'] 破坏性操作，须二次确认",
      "[intent=link, label='了解更多'] 弱化内联链接型操作",
      "[iconOnly=true, ariaLabel='提交'] 图标按钮无文本，必填 ariaLabel"
    ]
  },
  "hardRules": [
    {
      "expr": "fn:primary_max_one_per_action_group",
      "id": "HR-PRIMARY-MAX-ONE",
      "kind": "fn",
      "message": "Each action group may contain at most one Button with intent=primary."
    },
    {
      "expr": "fn:destructive_requires_confirmation",
      "id": "HR-DESTRUCTIVE-CONFIRM",
      "kind": "fn",
      "message": "A Button with intent=danger is a destructive action and must require confirmation (modal/popconfirm) before committing."
    },
    {
      "expr": "fn:icon_only_requires_aria_label",
      "id": "HR-ICONONLY-ARIA",
      "kind": "fn",
      "message": "A Button rendered icon-only (no children text) must set an ariaLabel to expose its purpose to assistive technology."
    },
    {
      "expr": "props.label && string_length(props.label) <= 28",
      "id": "HR-LABEL-LEN",
      "kind": "schema",
      "message": "Button label (children) must be <= 28 characters."
    },
    {
      "expr": "props.intent in ['primary','default','danger','dashed','link','text']",
      "id": "HR-INTENT-ENUM",
      "kind": "schema",
      "message": "intent must be one of the canonical axis values primary|default|danger|dashed|link|text."
    },
    {
      "expr": "props.intent == 'danger' ? props.danger == true : props.danger != true",
      "id": "HR-DANGER-COHERENCE",
      "kind": "schema",
      "message": "When intent='danger' the AntD danger boolean must be true; the canonical intent axis supersedes the raw boolean."
    },
    {
      "expr": "count_siblings_where(props.intent == 'primary') <= 1",
      "id": "HR-PRIMARY-SIBLING",
      "kind": "graph",
      "message": "At most one primary Button per sibling action group."
    }
  ],
  "id": "antd.button",
  "intents": [
    "primary_action",
    "secondary_action",
    "destructive_action"
  ],
  "meaning": {
    "definition": "在当前决策上下文触发一个明确的、有边界的用户操作，是页面中可执行动作的最小语义单元。",
    "doNotUseWhen": [
      "仅用于装饰或视觉分隔（用 layout/typography）",
      "承载可展开收起的内容容器（用 collapse 或 tag）",
      "作为纯导航且非主操作时（导航优先用 link 文本或 menu）",
      "需要承载多个操作（拆为多个 button 或 menu）"
    ],
    "useWhen": [
      "页面/弹窗底部需要主操作提交（intent=primary，每组最多 1 个）",
      "需要次要/取消类操作（intent=default）",
      "需要不可逆的破坏性操作（intent=danger，须二次确认）",
      "需要轻量、弱化视觉的操作（intent=text/link）",
      "需要虚线占位/引导新增（intent=dashed）"
    ]
  },
  "needsReview": false,
  "pencil": {
    "allowedDescendantOverrides": {
      "label.content": "props.label"
    },
    "componentRefPattern": "antd.button",
    "forbiddenOverrides": [
      "root.fill",
      "root.cornerRadius",
      "root.height",
      "label.fill",
      "label.fontSize",
      "label.fontWeight",
      "label.padding",
      "root.borderColor",
      "root.borderWidth"
    ],
    "rootNodeType": "button"
  },
  "props": {
    "ariaLabel": {
      "description": "无障碍标签。iconOnly=true 时必填。",
      "maxLength": 80,
      "required": false,
      "requiredWhen": "props.iconOnly == true",
      "type": "string"
    },
    "danger": {
      "default": false,
      "description": "是否为破坏性操作。当 intent=danger 时必须为 true，其余必须为 false（与 intent 轴保持一致，不应独立设置）。",
      "required": false,
      "type": "boolean"
    },
    "disabled": {
      "default": false,
      "description": "是否禁用。disabled 优先级高于 loading。",
      "required": false,
      "type": "boolean"
    },
    "icon": {
      "accepts": [
        "componentNode"
      ],
      "description": "前缀图标节点。图标按钮（无 children）必须配 ariaLabel。",
      "required": false,
      "type": "componentRef"
    },
    "iconOnly": {
      "default": false,
      "description": "是否仅含图标（无文本 children）。iconOnly=true 时 ariaLabel 必填。",
      "required": false,
      "type": "boolean"
    },
    "intent": {
      "default": "default",
      "description": "操作语义意图轴，归约 AntD type + danger 布尔。primary=主操作；default=次要；danger=破坏性（AntD danger=true）；dashed=虚线引导；link/text=弱化文本链接。",
      "enum": [
        "primary",
        "default",
        "danger",
        "dashed",
        "link",
        "text"
      ],
      "required": false,
      "type": "enum"
    },
    "label": {
      "accepts": [
        "string"
      ],
      "contentRules": [
        "length <= 28 chars",
        "plain text, no nested block markup"
      ],
      "description": "按钮文本，对应 AntD children。应使用动词短语且 <=28 字符。",
      "maxLength": 28,
      "required": true,
      "type": "string"
    },
    "loading": {
      "default": false,
      "description": "加载中状态，会覆盖 icon。提交类主操作常配 loading。",
      "required": false,
      "type": "boolean"
    },
    "size": {
      "default": "middle",
      "description": "尺寸轴：large/middle/small。",
      "enum": [
        "large",
        "middle",
        "small"
      ],
      "required": false,
      "type": "enum"
    }
  },
  "semanticRole": "action_trigger",
  "slots": {},
  "softRules": [
    "主操作建议放于操作组右侧（LTR）且 label 使用动词短语。",
    "避免把 destructive 与 primary 放在同一视觉权重，danger 应有更克制的形态。",
    "同一 action group 不应同时出现两个 intent=primary（交给 primary_max_one_per_action_group 校验）。",
    "loading 时不应再叠加 disabled，避免双重不可用语义。",
    "iconOnly 按钮建议用于工具栏/行内密集操作，而非页面主操作。"
  ],
  "sourceEvidence": [
    "https://ant.design/components/button",
    "https://ant.design/components/button#api",
    "https://ant.design/components/button#components-button-demo-basic"
  ],
  "sourceRefs": [
    "https://ant.design/components/button",
    "https://ant.design/components/button#api"
  ],
  "states": [
    "default",
    "hover",
    "active/pressed",
    "focus",
    "disabled",
    "loading"
  ],
  "system": "ant-design",
  "tokenBindings": {
    "label.fill": "button.primary.foreground",
    "root.cornerRadius": "button.radius",
    "root.fill": "button.primary.background",
    "root.height": "button.height.md"
  },
  "variants": {
    "intent": {
      "default": "default",
      "semantics": {
        "danger": "破坏性/不可逆操作，需二次确认",
        "dashed": "虚线引导/占位新增",
        "default": "次要操作",
        "link": "弱化内联链接型操作",
        "primary": "当前上下文的主操作，每组最多 1 个",
        "text": "最弱化的纯文本操作"
      },
      "values": [
        "primary",
        "default",
        "danger",
        "dashed",
        "link",
        "text"
      ]
    },
    "size": {
      "default": "middle",
      "semantics": {
        "large": "强调/页底主操作",
        "middle": "标准",
        "small": "密集表格/工具栏"
      },
      "values": [
        "large",
        "middle",
        "small"
      ]
    }
  },
  "version": "1.0.0"
}
